{
  "$schema": "./registry-v2.schema.json",
  "aliases": {
    "claude-desktop": "claude/desktop-chat",
    "codeium": "windsurf/ide",
    "jetbrains-ai": "jetbrains/ai-assistant",
    "trae-cn": "trae/cn-ide",
    "visual-studio": "copilot/visual-studio",
    "vscode": "copilot/vscode"
  },
  "candidate_discovery": {
    "auto_promote_threshold": {
      "min_detection_probes": 1,
      "min_official_sources": 2,
      "min_surfaces": 2
    },
    "enabled": false,
    "report_format": {
      "include_archived_products": true,
      "include_new_paths": true,
      "include_new_products": true,
      "include_renamed_products": true,
      "include_schema_changes": true,
      "suggest_registry_diff": true
    },
    "schedule": "disabled"
  },
  "detection_config": {
    "installation_states": [
      "installed",
      "configured-only",
      "compatibility-only",
      "cloud-connected",
      "legacy",
      "ambiguous",
      "not-detected"
    ],
    "platforms": [
      "darwin",
      "linux",
      "windows",
      "wsl",
      "remote-ssh",
      "dev-container",
      "codespaces",
      "vscode-profile",
      "extension-host"
    ],
    "probes": {
      "app-bundle": {
        "description": "macOS app bundle identifier lookup"
      },
      "binary": {
        "description": "CLI binary lookup with version command"
      },
      "cloud-account": {
        "description": "Cloud/API account connection check"
      },
      "environment": {
        "description": "Environment variable override for path"
      },
      "file-signature": {
        "description": "File path existence with content fingerprint"
      },
      "schema-probe": {
        "description": "JSON schema validation for config files"
      },
      "vscode-extension": {
        "description": "VS Code extension marketplace lookup"
      }
    }
  },
  "freshness": {
    "candidate_discovery_schedule": "disabled",
    "candidate_discovery_sources": [],
    "demote_stale_on_detect": true,
    "max_age_days": 365,
    "online_checks_enabled": false,
    "stale_levels": [
      "stale-partial",
      "stale-manual",
      "stale-source-only"
    ]
  },
  "object_policies": {
    "agent": "manual-template",
    "automation": "disabled-draft-only",
    "chat": "forbidden-regenerate",
    "cloud_knowledge": "official-api-or-rebuild-checklist",
    "command": "manual-rebuild",
    "config": "explicit-subobject-only",
    "cron": "disabled-draft-only",
    "database": "forbidden-regenerate",
    "generated_memory": "forbidden-regenerate",
    "hook": "disabled-draft-only",
    "instructions": "semantic-ir-with-loss-report",
    "mcp": "profile-version-adapter",
    "mode": "manual-template",
    "persona": "manual-template",
    "plugin": "manual-rebuild",
    "policy": "explicit-subobject-only",
    "prompt": "manual-rebuild",
    "rag_index": "forbidden-regenerate",
    "skill": "validate-then-atomic-copy",
    "trust": "never-migrate",
    "user_memory": "review-then-instructions-ir",
    "workflow": "manual-rebuild"
  },
  "products": {
    "aider": {
      "reference": "ides/aider.md",
      "template": "manual-reference"
    },
    "amazon-q": {
      "category": "agent-client",
      "default_profile": "ide",
      "display_name": "Amazon Q Developer",
      "lifecycle": "active",
      "profiles": {
        "cli": {
          "kind": "cli",
          "migration_policy": "manual-template",
          "sources": [
            "https://docs.aws.amazon.com/amazonq/latest/qdeveloper-ug/qdev-mcp.html"
          ],
          "surfaces": {
            "agents": [
              {
                "format": "amazon-q-agent",
                "path": "~/.aws/amazonq/cli-agents",
                "policy": "manual-template",
                "scope": "user",
                "storage": "directory"
              }
            ]
          },
          "verified_at": "2026-08-12",
          "version_range": "current as of 2026-08-12"
        },
        "custom-agent": {
          "kind": "custom-agent",
          "migration_policy": "manual-template",
          "sources": [
            "https://docs.aws.amazon.com/amazonq/latest/qdeveloper-ug/qdev-mcp.html"
          ],
          "surfaces": {
            "agents": [
              {
                "format": "amazon-q-agent",
                "path": "~/.aws/amazonq/agents",
                "policy": "manual-template",
                "scope": "user",
                "storage": "directory"
              }
            ]
          },
          "verified_at": "2026-08-12",
          "version_range": "current as of 2026-08-12"
        },
        "ide": {
          "kind": "ide-extension",
          "mcp_path_note": "Dual paths documented: ~/.aws/amazonq/default.json and ~/.aws/amazonq/agents/default.json - probe both and validate root key/signature",
          "migration_policy": "bidirectional-reviewed",
          "precedence": [
            "project-default",
            "user-default",
            "legacy-mcp"
          ],
          "sources": [
            "https://docs.aws.amazon.com/amazonq/latest/qdeveloper-ug/mcp-ide.html",
            "https://docs.aws.amazon.com/amazonq/latest/qdeveloper-ug/qdev-mcp.html"
          ],
          "surfaces": {
            "instructions": [
              {
                "format": "amazon-q-rule",
                "path": ".amazonq/rules",
                "policy": "semantic-ir-with-loss-report",
                "scope": "project",
                "storage": "directory"
              }
            ],
            "mcp": [
              {
                "compatibility_paths": [
                  "~/.aws/amazonq/mcp.json",
                  "~/.aws/amazonq/agents/default.json"
                ],
                "format": "json:mcpServers",
                "path": "~/.aws/amazonq/default.json",
                "policy": "profile-version-adapter",
                "scope": "user",
                "storage": "file"
              },
              {
                "compatibility_paths": [
                  ".amazonq/mcp.json",
                  ".amazonq/agents/default.json"
                ],
                "format": "json:mcpServers",
                "path": ".amazonq/default.json",
                "policy": "profile-version-adapter",
                "scope": "project",
                "storage": "file"
              }
            ]
          },
          "verified_at": "2026-08-12",
          "version_range": "current as of 2026-08-12"
        }
      }
    },
    "android-studio": {
      "reference": "ides/android-studio.md",
      "template": "manual-reference"
    },
    "antigravity": {
      "reference": "ides/antigravity.md",
      "template": "manual-reference"
    },
    "augment-code": {
      "category": "agent-client",
      "default_profile": "cli-ide",
      "display_name": "Augment Code",
      "lifecycle": "active",
      "profiles": {
        "cli-ide": {
          "kind": "cli-and-ide",
          "migration_policy": "bidirectional-reviewed",
          "sources": [
            "https://docs.augmentcode.com/cli/rules",
            "https://docs.augmentcode.com/cli/reference",
            "https://docs.augmentcode.com/cli/config"
          ],
          "surfaces": {
            "instructions": [
              {
                "format": "augment-rule",
                "path": "~/.augment/rules",
                "policy": "semantic-ir-with-loss-report",
                "scope": "user",
                "storage": "directory"
              },
              {
                "format": "augment-rule",
                "path": ".augment/rules",
                "policy": "semantic-ir-with-loss-report",
                "scope": "project",
                "storage": "directory"
              },
              {
                "format": "plain-markdown",
                "path": "~/.augment/user-guidelines.md",
                "policy": "semantic-ir-with-loss-report",
                "scope": "user",
                "storage": "file"
              }
            ],
            "mcp": [
              {
                "format": "json:mcpServers",
                "path": "~/.augment/settings.json",
                "policy": "profile-version-adapter",
                "scope": "user",
                "storage": "config-subobject"
              },
              {
                "format": "json:mcpServers",
                "path": ".augment/settings.json",
                "policy": "profile-version-adapter",
                "scope": "project",
                "storage": "config-subobject"
              },
              {
                "format": "json:mcpServers",
                "path": ".augment/settings.local.json",
                "policy": "profile-version-adapter",
                "scope": "local",
                "storage": "config-subobject"
              }
            ],
            "skills": [
              {
                "format": "agent-skill",
                "path": "~/.augment/skills",
                "policy": "validate-then-atomic-copy",
                "scope": "user",
                "storage": "directory"
              },
              {
                "format": "agent-skill",
                "path": ".augment/skills",
                "policy": "validate-then-atomic-copy",
                "scope": "project",
                "storage": "directory"
              }
            ]
          },
          "verified_at": "2026-08-12",
          "version_range": "current as of 2026-08-12"
        }
      }
    },
    "baidu-comate": {
      "reference": "ides/baidu-comate.md",
      "template": "manual-reference"
    },
    "baidu-comate-ide": {
      "reference": "ides/baidu-comate-ide.md",
      "template": "manual-reference"
    },
    "blackbox": {
      "reference": "ides/blackbox.md",
      "template": "manual-reference"
    },
    "bolt-new": {
      "reference": "ides/bolt-new.md",
      "template": "cloud-ui"
    },
    "claude": {